{
  "$schema": "../contracts/module-manifest.schema.json",
  "id": "engine",
  "name": "Billy Engine",
  "version": "0.2.0",
  "status": "foundation",
  "purpose": "Reusable platform and game-system services used by BillysLab and future games.",
  "owns": [
    "contracts",
    "events",
    "identity",
    "storage",
    "repositories",
    "sync",
    "cloud-api",
    "progression-mechanics",
    "collection-mechanics",
    "publishing-services",
    "validation-tools",
    "service-worker",
    "data-contracts",
    "item-identity-contract",
    "collection-projection",
    "curator-record-contracts"
  ],
  "reservedSystems": [
    "accounts",
    "authentication-linking",
    "permissions-roles",
    "privacy-moderation",
    "onboarding",
    "notifications",
    "analytics",
    "social-leaderboards",
    "seasons-events"
  ],
  "dependsOn": [],
  "mayImport": [],
  "mustNotImport": [
    "museum",
    "curator",
    "billyslab-content"
  ],
  "exports": [
    "versioned-contracts",
    "event-bus-contract",
    "identity-service",
    "storage-adapters",
    "repository-interfaces",
    "sync-manager",
    "progress-service",
    "collection-service",
    "publishing-service",
    "public-data-projection"
  ],
  "currentEvidence": [
    "billy-device-identity.js",
    "billy-storage.js",
    "billy-storage-adapters.js",
    "billy-repositories.js",
    "billy-cloud-api.js",
    "billy-cloud-config.js",
    "billy-sync-manager.js",
    "progress-engine.js",
    "mashup-core.js",
    "mashup-discovery.js",
    "mashup-search.js",
    "worker/",
    "tools/data-integrity-validator.js",
    "tools/performance-benchmark.js"
  ]
}
